"No.","Time","Source","Destination","Protocol","Length","Info"
"1","2020-01-01 18:52:59.249670","VMware_c0:00:08","Broadcast","ARP","42","Who has 192.168.159.131? Tell 192.168.159.10"
"2","2020-01-01 18:52:59.250017","VMware_48:50:c7","VMware_c0:00:08","ARP","42","192.168.159.131 is at 00:0c:29:48:50:c7"
"3","2020-01-01 18:53:10.732644","VMware_c0:00:08","Broadcast","ARP","42","Who has 192.168.159.131? Tell 192.168.159.11"
"4","2020-01-01 18:53:10.732845","VMware_48:50:c7","VMware_c0:00:08","ARP","42","192.168.159.131 is at 00:0c:29:48:50:c7"
"5","2020-01-01 18:53:15.830120","192.168.159.10","192.168.159.131","TCP","58","62860  >  80 [SYN] Seq=0 Win=1024 Len=0 MSS=1460"
"6","2020-01-01 18:53:15.830322","192.168.159.131","192.168.159.10","TCP","58","80  >  62860 [SYN, ACK] Seq=0 Ack=1 Win=5840 Len=0 MSS=1460"
"7","2020-01-01 18:53:15.830386","192.168.159.10","192.168.159.131","TCP","54","62860  >  80 [RST] Seq=1 Win=0 Len=0"
"8","2020-01-01 18:53:15.881431","192.168.159.10","192.168.159.131","TCP","66","5339  >  80 [SYN] Seq=0 Win=64240 Len=0 MSS=1460 WS=256 SACK_PERM"
"9","2020-01-01 18:53:15.881586","192.168.159.131","192.168.159.10","TCP","66","80  >  5339 [SYN, ACK] Seq=0 Ack=1 Win=5840 Len=0 MSS=1460 SACK_PERM WS=128"
"10","2020-01-01 18:53:15.881789","192.168.159.10","192.168.159.131","TCP","54","5339  >  80 [ACK] Seq=1 Ack=1 Win=1051136 Len=0"
"11","2020-01-01 18:53:15.933244","192.168.159.10","192.168.159.131","HTTP","72","GET / HTTP/1.0 "
"12","2020-01-01 18:53:15.933393","192.168.159.131","192.168.159.10","TCP","54","80  >  5339 [ACK] Seq=1 Ack=19 Win=5888 Len=0"
"13","2020-01-01 18:53:15.933781","192.168.159.131","192.168.159.10","HTTP","986","HTTP/1.1 200 OK  (text/html)"
"14","2020-01-01 18:53:15.934092","192.168.159.131","192.168.159.10","TCP","54","80  >  5339 [FIN, ACK] Seq=933 Ack=19 Win=5888 Len=0"
"15","2020-01-01 18:53:15.934135","192.168.159.10","192.168.159.131","TCP","54","5339  >  80 [ACK] Seq=19 Ack=934 Win=1050112 Len=0"
"16","2020-01-01 18:53:16.033959","192.168.159.10","192.168.159.131","TCP","54","5339  >  80 [FIN, ACK] Seq=19 Ack=934 Win=1050112 Len=0"
"17","2020-01-01 18:53:16.034083","192.168.159.131","192.168.159.10","TCP","54","80  >  5339 [ACK] Seq=934 Ack=20 Win=5888 Len=0"
"18","2020-01-01 18:53:16.034345","192.168.159.10","192.168.159.131","TCP","66","5340  >  80 [SYN] Seq=0 Win=64240 Len=0 MSS=1460 WS=256 SACK_PERM"
"19","2020-01-01 18:53:16.034451","192.168.159.131","192.168.159.10","TCP","66","80  >  5340 [SYN, ACK] Seq=0 Ack=1 Win=5840 Len=0 MSS=1460 SACK_PERM WS=128"
"20","2020-01-01 18:53:16.034549","192.168.159.10","192.168.159.131","TCP","54","5340  >  80 [ACK] Seq=1 Ack=1 Win=1051136 Len=0"
"21","2020-01-01 18:53:16.086846","192.168.159.10","192.168.159.131","HTTP","188","GET / HTTP/1.1 "
"22","2020-01-01 18:53:16.087095","192.168.159.131","192.168.159.10","TCP","54","80  >  5340 [ACK] Seq=1 Ack=135 Win=6912 Len=0"
"23","2020-01-01 18:53:16.087346","192.168.159.131","192.168.159.10","HTTP","967","HTTP/1.1 200 OK  (text/html)"
"24","2020-01-01 18:53:16.129661","192.168.159.10","192.168.159.131","TCP","54","5340  >  80 [ACK] Seq=135 Ack=914 Win=1050112 Len=0"
"25","2020-01-01 18:53:17.887233","VMware_c0:00:08","Broadcast","ARP","42","Who has 192.168.159.131? Tell 192.168.159.12"
"26","2020-01-01 18:53:17.887450","VMware_48:50:c7","VMware_c0:00:08","ARP","42","192.168.159.131 is at 00:0c:29:48:50:c7"
"27","2020-01-01 18:53:23.769291","VMware_c0:00:08","Broadcast","ARP","42","Who has 192.168.159.131? Tell 192.168.159.14"
"28","2020-01-01 18:53:23.769466","VMware_48:50:c7","VMware_c0:00:08","ARP","42","192.168.159.131 is at 00:0c:29:48:50:c7"
"29","2020-01-01 18:53:26.232998","192.168.159.10","192.168.159.131","TCP","54","5340  >  80 [FIN, ACK] Seq=135 Ack=914 Win=1050112 Len=0"
"30","2020-01-01 18:53:26.233422","192.168.159.131","192.168.159.10","TCP","54","80  >  5340 [FIN, ACK] Seq=914 Ack=136 Win=6912 Len=0"
"31","2020-01-01 18:53:26.233558","192.168.159.10","192.168.159.131","TCP","54","5340  >  80 [ACK] Seq=136 Ack=915 Win=1050112 Len=0"
"32","2020-01-01 18:53:26.233658","192.168.159.10","192.168.159.131","TCP","66","5343  >  80 [SYN] Seq=0 Win=64240 Len=0 MSS=1460 WS=256 SACK_PERM"
"33","2020-01-01 18:53:26.233996","192.168.159.131","192.168.159.10","TCP","66","80  >  5343 [SYN, ACK] Seq=0 Ack=1 Win=5840 Len=0 MSS=1460 SACK_PERM WS=128"
"34","2020-01-01 18:53:26.234168","192.168.159.10","192.168.159.131","TCP","54","5343  >  80 [ACK] Seq=1 Ack=1 Win=1051136 Len=0"
"35","2020-01-01 18:53:26.293786","192.168.159.10","192.168.159.131","HTTP","188","GET / HTTP/1.1 "
"36","2020-01-01 18:53:26.294221","192.168.159.131","192.168.159.10","TCP","54","80  >  5343 [ACK] Seq=1 Ack=135 Win=6912 Len=0"
"37","2020-01-01 18:53:26.294863","192.168.159.131","192.168.159.10","HTTP","967","HTTP/1.1 200 OK  (text/html)"
"38","2020-01-01 18:53:26.335688","192.168.159.10","192.168.159.131","TCP","54","5343  >  80 [ACK] Seq=135 Ack=914 Win=1050112 Len=0"
"39","2020-01-01 18:53:27.279389","192.168.159.11","192.168.159.131","TCP","58","45136  >  80 [SYN] Seq=0 Win=1024 Len=0 MSS=1460"
"40","2020-01-01 18:53:27.279881","192.168.159.131","192.168.159.11","TCP","58","80  >  45136 [SYN, ACK] Seq=0 Ack=1 Win=5840 Len=0 MSS=1460"
"41","2020-01-01 18:53:27.280029","192.168.159.11","192.168.159.131","TCP","54","45136  >  80 [RST] Seq=1 Win=0 Len=0"
"42","2020-01-01 18:53:27.332912","192.168.159.11","192.168.159.131","TCP","66","5345  >  80 [SYN] Seq=0 Win=64240 Len=0 MSS=1460 WS=256 SACK_PERM"
"43","2020-01-01 18:53:27.333121","192.168.159.131","192.168.159.11","TCP","66","80  >  5345 [SYN, ACK] Seq=0 Ack=1 Win=5840 Len=0 MSS=1460 SACK_PERM WS=128"
"44","2020-01-01 18:53:27.333254","192.168.159.11","192.168.159.131","TCP","54","5345  >  80 [ACK] Seq=1 Ack=1 Win=1051136 Len=0"
"45","2020-01-01 18:53:27.389386","192.168.159.11","192.168.159.131","HTTP","72","GET / HTTP/1.0 "
"46","2020-01-01 18:53:27.389619","192.168.159.131","192.168.159.11","TCP","54","80  >  5345 [ACK] Seq=1 Ack=19 Win=5888 Len=0"
"47","2020-01-01 18:53:27.390049","192.168.159.131","192.168.159.11","HTTP","986","HTTP/1.1 200 OK  (text/html)"
"48","2020-01-01 18:53:27.390706","192.168.159.131","192.168.159.11","TCP","54","80  >  5345 [FIN, ACK] Seq=933 Ack=19 Win=5888 Len=0"
"49","2020-01-01 18:53:27.390787","192.168.159.11","192.168.159.131","TCP","54","5345  >  80 [ACK] Seq=19 Ack=934 Win=1050112 Len=0"
"50","2020-01-01 18:53:27.489358","192.168.159.11","192.168.159.131","TCP","54","5345  >  80 [FIN, ACK] Seq=19 Ack=934 Win=1050112 Len=0"
"51","2020-01-01 18:53:27.489683","192.168.159.131","192.168.159.11","TCP","54","80  >  5345 [ACK] Seq=934 Ack=20 Win=5888 Len=0"
"52","2020-01-01 18:53:27.489696","192.168.159.11","192.168.159.131","TCP","66","5346  >  80 [SYN] Seq=0 Win=64240 Len=0 MSS=1460 WS=256 SACK_PERM"
"53","2020-01-01 18:53:27.489804","192.168.159.131","192.168.159.11","TCP","66","80  >  5346 [SYN, ACK] Seq=0 Ack=1 Win=5840 Len=0 MSS=1460 SACK_PERM WS=128"
"54","2020-01-01 18:53:27.489890","192.168.159.11","192.168.159.131","TCP","54","5346  >  80 [ACK] Seq=1 Ack=1 Win=1051136 Len=0"
"55","2020-01-01 18:53:27.547939","192.168.159.11","192.168.159.131","HTTP","188","GET / HTTP/1.1 "
"56","2020-01-01 18:53:27.548292","192.168.159.131","192.168.159.11","TCP","54","80  >  5346 [ACK] Seq=1 Ack=135 Win=6912 Len=0"
"57","2020-01-01 18:53:27.548643","192.168.159.131","192.168.159.11","HTTP","967","HTTP/1.1 200 OK  (text/html)"
"58","2020-01-01 18:53:27.589321","192.168.159.11","192.168.159.131","TCP","54","5346  >  80 [ACK] Seq=135 Ack=914 Win=1050112 Len=0"
"59","2020-01-01 18:53:34.453687","192.168.159.12","192.168.159.131","TCP","58","34867  >  80 [SYN] Seq=0 Win=1024 Len=0 MSS=1460"
"60","2020-01-01 18:53:34.454219","192.168.159.131","192.168.159.12","TCP","58","80  >  34867 [SYN, ACK] Seq=0 Ack=1 Win=5840 Len=0 MSS=1460"
"61","2020-01-01 18:53:34.454376","192.168.159.12","192.168.159.131","TCP","54","34867  >  80 [RST] Seq=1 Win=0 Len=0"
"62","2020-01-01 18:53:34.505704","192.168.159.12","192.168.159.131","TCP","66","5349  >  80 [SYN] Seq=0 Win=64240 Len=0 MSS=1460 WS=256 SACK_PERM"
"63","2020-01-01 18:53:34.505901","192.168.159.131","192.168.159.12","TCP","66","80  >  5349 [SYN, ACK] Seq=0 Ack=1 Win=5840 Len=0 MSS=1460 SACK_PERM WS=128"
"64","2020-01-01 18:53:34.506037","192.168.159.12","192.168.159.131","TCP","54","5349  >  80 [ACK] Seq=1 Ack=1 Win=1051136 Len=0"
"65","2020-01-01 18:53:34.557995","192.168.159.12","192.168.159.131","HTTP","72","GET / HTTP/1.0 "
"66","2020-01-01 18:53:34.558263","192.168.159.131","192.168.159.12","TCP","54","80  >  5349 [ACK] Seq=1 Ack=19 Win=5888 Len=0"
"67","2020-01-01 18:53:34.558676","192.168.159.131","192.168.159.12","HTTP","986","HTTP/1.1 200 OK  (text/html)"
"68","2020-01-01 18:53:34.559454","192.168.159.131","192.168.159.12","TCP","54","80  >  5349 [FIN, ACK] Seq=933 Ack=19 Win=5888 Len=0"
"69","2020-01-01 18:53:34.559518","192.168.159.12","192.168.159.131","TCP","54","5349  >  80 [ACK] Seq=19 Ack=934 Win=1050112 Len=0"
"70","2020-01-01 18:53:34.660022","192.168.159.12","192.168.159.131","TCP","54","5349  >  80 [FIN, ACK] Seq=19 Ack=934 Win=1050112 Len=0"
"71","2020-01-01 18:53:34.660235","192.168.159.131","192.168.159.12","TCP","54","80  >  5349 [ACK] Seq=934 Ack=20 Win=5888 Len=0"
"72","2020-01-01 18:53:34.660460","192.168.159.12","192.168.159.131","TCP","66","5350  >  80 [SYN] Seq=0 Win=64240 Len=0 MSS=1460 WS=256 SACK_PERM"
"73","2020-01-01 18:53:34.660608","192.168.159.131","192.168.159.12","TCP","66","80  >  5350 [SYN, ACK] Seq=0 Ack=1 Win=5840 Len=0 MSS=1460 SACK_PERM WS=128"
"74","2020-01-01 18:53:34.660725","192.168.159.12","192.168.159.131","TCP","54","5350  >  80 [ACK] Seq=1 Ack=1 Win=1051136 Len=0"
"75","2020-01-01 18:53:34.716251","192.168.159.12","192.168.159.131","HTTP","188","GET / HTTP/1.1 "
"76","2020-01-01 18:53:34.716601","192.168.159.131","192.168.159.12","TCP","54","80  >  5350 [ACK] Seq=1 Ack=135 Win=6912 Len=0"
"77","2020-01-01 18:53:34.716935","192.168.159.131","192.168.159.12","HTTP","967","HTTP/1.1 200 OK  (text/html)"
"78","2020-01-01 18:53:34.759932","192.168.159.12","192.168.159.131","TCP","54","5350  >  80 [ACK] Seq=135 Ack=914 Win=1050112 Len=0"
"79","2020-01-01 18:53:36.445089","192.168.159.10","192.168.159.131","TCP","54","5343  >  80 [FIN, ACK] Seq=135 Ack=914 Win=1050112 Len=0"
"80","2020-01-01 18:53:36.445436","192.168.159.131","192.168.159.10","TCP","54","80  >  5343 [FIN, ACK] Seq=914 Ack=136 Win=6912 Len=0"
"81","2020-01-01 18:53:36.445583","192.168.159.10","192.168.159.131","TCP","54","5343  >  80 [ACK] Seq=136 Ack=915 Win=1050112 Len=0"
"82","2020-01-01 18:53:36.445710","192.168.159.10","192.168.159.131","TCP","66","5352  >  80 [SYN] Seq=0 Win=64240 Len=0 MSS=1460 WS=256 SACK_PERM"
"83","2020-01-01 18:53:36.446089","192.168.159.131","192.168.159.10","TCP","66","80  >  5352 [SYN, ACK] Seq=0 Ack=1 Win=5840 Len=0 MSS=1460 SACK_PERM WS=128"
"84","2020-01-01 18:53:36.446254","192.168.159.10","192.168.159.131","TCP","54","5352  >  80 [ACK] Seq=1 Ack=1 Win=1051136 Len=0"
"85","2020-01-01 18:53:36.505077","192.168.159.10","192.168.159.131","HTTP","188","GET / HTTP/1.1 "
"86","2020-01-01 18:53:36.505474","192.168.159.131","192.168.159.10","TCP","54","80  >  5352 [ACK] Seq=1 Ack=135 Win=6912 Len=0"
"87","2020-01-01 18:53:36.505881","192.168.159.131","192.168.159.10","HTTP","967","HTTP/1.1 200 OK  (text/html)"
"88","2020-01-01 18:53:36.551680","192.168.159.10","192.168.159.131","TCP","54","5352  >  80 [ACK] Seq=135 Ack=914 Win=1050112 Len=0"
"89","2020-01-01 18:53:37.653838","192.168.159.11","192.168.159.131","TCP","54","5346  >  80 [FIN, ACK] Seq=135 Ack=914 Win=1050112 Len=0"
"90","2020-01-01 18:53:37.654293","192.168.159.131","192.168.159.11","TCP","54","80  >  5346 [FIN, ACK] Seq=914 Ack=136 Win=6912 Len=0"
"91","2020-01-01 18:53:37.654433","192.168.159.11","192.168.159.131","TCP","54","5346  >  80 [ACK] Seq=136 Ack=915 Win=1050112 Len=0"
"92","2020-01-01 18:53:37.654501","192.168.159.11","192.168.159.131","TCP","66","5354  >  80 [SYN] Seq=0 Win=64240 Len=0 MSS=1460 WS=256 SACK_PERM"
"93","2020-01-01 18:53:37.655013","192.168.159.131","192.168.159.11","TCP","66","80  >  5354 [SYN, ACK] Seq=0 Ack=1 Win=5840 Len=0 MSS=1460 SACK_PERM WS=128"
"94","2020-01-01 18:53:37.655202","192.168.159.11","192.168.159.131","TCP","54","5354  >  80 [ACK] Seq=1 Ack=1 Win=1051136 Len=0"
"95","2020-01-01 18:53:37.712576","192.168.159.11","192.168.159.131","HTTP","188","GET / HTTP/1.1 "
"96","2020-01-01 18:53:37.713158","192.168.159.131","192.168.159.11","TCP","54","80  >  5354 [ACK] Seq=1 Ack=135 Win=6912 Len=0"
"97","2020-01-01 18:53:37.713646","192.168.159.131","192.168.159.11","HTTP","967","HTTP/1.1 200 OK  (text/html)"
"98","2020-01-01 18:53:37.753969","192.168.159.11","192.168.159.131","TCP","54","5354  >  80 [ACK] Seq=135 Ack=914 Win=1050112 Len=0"
"99","2020-01-01 18:53:40.327112","192.168.159.14","192.168.159.131","TCP","58","42195  >  80 [SYN] Seq=0 Win=1024 Len=0 MSS=1460"
"100","2020-01-01 18:53:40.327554","192.168.159.131","192.168.159.14","TCP","58","80  >  42195 [SYN, ACK] Seq=0 Ack=1 Win=5840 Len=0 MSS=1460"
"101","2020-01-01 18:53:40.327688","192.168.159.14","192.168.159.131","TCP","54","42195  >  80 [RST] Seq=1 Win=0 Len=0"
"102","2020-01-01 18:53:40.382123","192.168.159.14","192.168.159.131","TCP","66","5356  >  80 [SYN] Seq=0 Win=64240 Len=0 MSS=1460 WS=256 SACK_PERM"
"103","2020-01-01 18:53:40.382257","192.168.159.131","192.168.159.14","TCP","66","80  >  5356 [SYN, ACK] Seq=0 Ack=1 Win=5840 Len=0 MSS=1460 SACK_PERM WS=128"
"104","2020-01-01 18:53:40.382365","192.168.159.14","192.168.159.131","TCP","54","5356  >  80 [ACK] Seq=1 Ack=1 Win=1051136 Len=0"
"105","2020-01-01 18:53:40.434655","192.168.159.14","192.168.159.131","HTTP","72","GET / HTTP/1.0 "
"106","2020-01-01 18:53:40.434790","192.168.159.131","192.168.159.14","TCP","54","80  >  5356 [ACK] Seq=1 Ack=19 Win=5888 Len=0"
"107","2020-01-01 18:53:40.435079","192.168.159.131","192.168.159.14","HTTP","986","HTTP/1.1 200 OK  (text/html)"
"108","2020-01-01 18:53:40.435361","192.168.159.131","192.168.159.14","TCP","54","80  >  5356 [FIN, ACK] Seq=933 Ack=19 Win=5888 Len=0"
"109","2020-01-01 18:53:40.435407","192.168.159.14","192.168.159.131","TCP","54","5356  >  80 [ACK] Seq=19 Ack=934 Win=1050112 Len=0"
"110","2020-01-01 18:53:40.534732","192.168.159.14","192.168.159.131","TCP","54","5356  >  80 [FIN, ACK] Seq=19 Ack=934 Win=1050112 Len=0"
"111","2020-01-01 18:53:40.534849","192.168.159.131","192.168.159.14","TCP","54","80  >  5356 [ACK] Seq=934 Ack=20 Win=5888 Len=0"
"112","2020-01-01 18:53:40.535021","192.168.159.14","192.168.159.131","TCP","66","5358  >  80 [SYN] Seq=0 Win=64240 Len=0 MSS=1460 WS=256 SACK_PERM"
"113","2020-01-01 18:53:40.535101","192.168.159.131","192.168.159.14","TCP","66","80  >  5358 [SYN, ACK] Seq=0 Ack=1 Win=5840 Len=0 MSS=1460 SACK_PERM WS=128"
"114","2020-01-01 18:53:40.535162","192.168.159.14","192.168.159.131","TCP","54","5358  >  80 [ACK] Seq=1 Ack=1 Win=1051136 Len=0"
"115","2020-01-01 18:53:40.588098","192.168.159.14","192.168.159.131","HTTP","188","GET / HTTP/1.1 "
"116","2020-01-01 18:53:40.588362","192.168.159.131","192.168.159.14","TCP","54","80  >  5358 [ACK] Seq=1 Ack=135 Win=6912 Len=0"
"117","2020-01-01 18:53:40.588662","192.168.159.131","192.168.159.14","HTTP","967","HTTP/1.1 200 OK  (text/html)"
"118","2020-01-01 18:53:40.632423","192.168.159.14","192.168.159.131","TCP","54","5358  >  80 [ACK] Seq=135 Ack=914 Win=1050112 Len=0"
"119","2020-01-01 18:53:41.436238","192.168.159.1","239.255.255.250","SSDP","215","M-SEARCH * HTTP/1.1 "
"120","2020-01-01 18:53:42.439671","192.168.159.1","239.255.255.250","SSDP","215","M-SEARCH * HTTP/1.1 "
"121","2020-01-01 18:53:42.459269","VMware_c0:00:08","Broadcast","ARP","42","Who has 192.168.159.131? Tell 192.168.159.13"
"122","2020-01-01 18:53:42.459438","VMware_48:50:c7","VMware_c0:00:08","ARP","42","192.168.159.131 is at 00:0c:29:48:50:c7"
"123","2020-01-01 18:53:43.445595","192.168.159.1","239.255.255.250","SSDP","215","M-SEARCH * HTTP/1.1 "
"124","2020-01-01 18:53:44.445405","192.168.159.1","239.255.255.250","SSDP","215","M-SEARCH * HTTP/1.1 "
"125","2020-01-01 18:53:44.835643","192.168.159.12","192.168.159.131","TCP","54","5350  >  80 [FIN, ACK] Seq=135 Ack=914 Win=1050112 Len=0"
"126","2020-01-01 18:53:44.835848","192.168.159.131","192.168.159.12","TCP","54","80  >  5350 [FIN, ACK] Seq=914 Ack=136 Win=6912 Len=0"
"127","2020-01-01 18:53:44.835943","192.168.159.12","192.168.159.131","TCP","54","5350  >  80 [ACK] Seq=136 Ack=915 Win=1050112 Len=0"
"128","2020-01-01 18:53:44.836111","192.168.159.12","192.168.159.131","TCP","66","5360  >  80 [SYN] Seq=0 Win=64240 Len=0 MSS=1460 WS=256 SACK_PERM"
"129","2020-01-01 18:53:44.836346","192.168.159.131","192.168.159.12","TCP","66","80  >  5360 [SYN, ACK] Seq=0 Ack=1 Win=5840 Len=0 MSS=1460 SACK_PERM WS=128"
"130","2020-01-01 18:53:44.836470","192.168.159.12","192.168.159.131","TCP","54","5360  >  80 [ACK] Seq=1 Ack=1 Win=1051136 Len=0"
"131","2020-01-01 18:53:44.892634","192.168.159.12","192.168.159.131","HTTP","188","GET / HTTP/1.1 "
"132","2020-01-01 18:53:44.893001","192.168.159.131","192.168.159.12","TCP","54","80  >  5360 [ACK] Seq=1 Ack=135 Win=6912 Len=0"
"133","2020-01-01 18:53:44.894257","192.168.159.131","192.168.159.12","HTTP","967","HTTP/1.1 200 OK  (text/html)"
"134","2020-01-01 18:53:44.937622","192.168.159.12","192.168.159.131","TCP","54","5360  >  80 [ACK] Seq=135 Ack=914 Win=1050112 Len=0"
"135","2020-01-01 18:53:46.607589","192.168.159.10","192.168.159.131","TCP","54","5352  >  80 [FIN, ACK] Seq=135 Ack=914 Win=1050112 Len=0"
"136","2020-01-01 18:53:46.607972","192.168.159.131","192.168.159.10","TCP","54","80  >  5352 [FIN, ACK] Seq=914 Ack=136 Win=6912 Len=0"
"137","2020-01-01 18:53:46.608107","192.168.159.10","192.168.159.131","TCP","54","5352  >  80 [ACK] Seq=136 Ack=915 Win=1050112 Len=0"
"138","2020-01-01 18:53:46.608154","192.168.159.10","192.168.159.131","TCP","66","5362  >  80 [SYN] Seq=0 Win=64240 Len=0 MSS=1460 WS=256 SACK_PERM"
"139","2020-01-01 18:53:46.608334","192.168.159.131","192.168.159.10","TCP","66","80  >  5362 [SYN, ACK] Seq=0 Ack=1 Win=5840 Len=0 MSS=1460 SACK_PERM WS=128"
"140","2020-01-01 18:53:46.608504","192.168.159.10","192.168.159.131","TCP","54","5362  >  80 [ACK] Seq=1 Ack=1 Win=1051136 Len=0"
"141","2020-01-01 18:53:46.667150","192.168.159.10","192.168.159.131","HTTP","188","GET / HTTP/1.1 "
"142","2020-01-01 18:53:46.667646","192.168.159.131","192.168.159.10","TCP","54","80  >  5362 [ACK] Seq=1 Ack=135 Win=6912 Len=0"
"143","2020-01-01 18:53:46.668394","192.168.159.131","192.168.159.10","HTTP","967","HTTP/1.1 200 OK  (text/html)"
"144","2020-01-01 18:53:46.714071","192.168.159.10","192.168.159.131","TCP","54","5362  >  80 [ACK] Seq=135 Ack=914 Win=1050112 Len=0"
"145","2020-01-01 18:53:47.819990","192.168.159.11","192.168.159.131","TCP","54","5354  >  80 [FIN, ACK] Seq=135 Ack=914 Win=1050112 Len=0"
"146","2020-01-01 18:53:47.820403","192.168.159.131","192.168.159.11","TCP","54","80  >  5354 [FIN, ACK] Seq=914 Ack=136 Win=6912 Len=0"
"147","2020-01-01 18:53:47.820539","192.168.159.11","192.168.159.131","TCP","54","5354  >  80 [ACK] Seq=136 Ack=915 Win=1050112 Len=0"
"148","2020-01-01 18:53:47.820637","192.168.159.11","192.168.159.131","TCP","66","5364  >  80 [SYN] Seq=0 Win=64240 Len=0 MSS=1460 WS=256 SACK_PERM"
"149","2020-01-01 18:53:47.820987","192.168.159.131","192.168.159.11","TCP","66","80  >  5364 [SYN, ACK] Seq=0 Ack=1 Win=5840 Len=0 MSS=1460 SACK_PERM WS=128"
"150","2020-01-01 18:53:47.821155","192.168.159.11","192.168.159.131","TCP","54","5364  >  80 [ACK] Seq=1 Ack=1 Win=131328 Len=0"
"151","2020-01-01 18:53:47.880463","192.168.159.11","192.168.159.131","HTTP","188","GET / HTTP/1.1 "
"152","2020-01-01 18:53:47.880930","192.168.159.131","192.168.159.11","TCP","54","80  >  5364 [ACK] Seq=1 Ack=135 Win=6912 Len=0"
"153","2020-01-01 18:53:47.881361","192.168.159.131","192.168.159.11","HTTP","967","HTTP/1.1 200 OK  (text/html)"
"154","2020-01-01 18:53:47.926424","192.168.159.11","192.168.159.131","TCP","54","5364  >  80 [ACK] Seq=135 Ack=914 Win=130304 Len=0"
"155","2020-01-01 18:53:50.722901","192.168.159.14","192.168.159.131","TCP","54","5358  >  80 [FIN, ACK] Seq=135 Ack=914 Win=1050112 Len=0"
"156","2020-01-01 18:53:50.723089","192.168.159.131","192.168.159.14","TCP","54","80  >  5358 [FIN, ACK] Seq=914 Ack=136 Win=6912 Len=0"
"157","2020-01-01 18:53:50.723183","192.168.159.14","192.168.159.131","TCP","54","5358  >  80 [ACK] Seq=136 Ack=915 Win=1050112 Len=0"
"158","2020-01-01 18:53:50.723468","192.168.159.14","192.168.159.131","TCP","66","5366  >  80 [SYN] Seq=0 Win=64240 Len=0 MSS=1460 WS=256 SACK_PERM"
"159","2020-01-01 18:53:50.723700","192.168.159.131","192.168.159.14","TCP","66","80  >  5366 [SYN, ACK] Seq=0 Ack=1 Win=5840 Len=0 MSS=1460 SACK_PERM WS=128"
"160","2020-01-01 18:53:50.723843","192.168.159.14","192.168.159.131","TCP","54","5366  >  80 [ACK] Seq=1 Ack=1 Win=1051136 Len=0"
"161","2020-01-01 18:53:50.780908","192.168.159.14","192.168.159.131","HTTP","188","GET / HTTP/1.1 "
"162","2020-01-01 18:53:50.781127","192.168.159.131","192.168.159.14","TCP","54","80  >  5366 [ACK] Seq=1 Ack=135 Win=6912 Len=0"
"163","2020-01-01 18:53:50.781463","192.168.159.131","192.168.159.14","HTTP","967","HTTP/1.1 200 OK  (text/html)"
"164","2020-01-01 18:53:50.825671","192.168.159.14","192.168.159.131","TCP","54","5366  >  80 [ACK] Seq=135 Ack=914 Win=1050112 Len=0"
"165","2020-01-01 18:53:54.877474","192.168.159.131","192.168.159.255","BROWSER","273","Local Master Announcement BEE-BOX, Workstation, Server, Print Queue Server, Xenix Server, NT Workstation, NT Server, Master Browser, DFS server"
"166","2020-01-01 18:53:54.878054","192.168.159.131","192.168.159.255","BROWSER","250","Domain/Workgroup Announcement ITSECGAMES, NT Workstation, Domain Enum"
"167","2020-01-01 18:53:55.021272","192.168.159.12","192.168.159.131","TCP","54","5360  >  80 [FIN, ACK] Seq=135 Ack=914 Win=1050112 Len=0"
"168","2020-01-01 18:53:55.021517","192.168.159.131","192.168.159.12","TCP","54","80  >  5360 [FIN, ACK] Seq=914 Ack=136 Win=6912 Len=0"
"169","2020-01-01 18:53:55.021621","192.168.159.12","192.168.159.131","TCP","54","5360  >  80 [ACK] Seq=136 Ack=915 Win=1050112 Len=0"
"170","2020-01-01 18:53:55.021818","192.168.159.12","192.168.159.131","TCP","66","5368  >  80 [SYN] Seq=0 Win=64240 Len=0 MSS=1460 WS=256 SACK_PERM"
"171","2020-01-01 18:53:55.022014","192.168.159.131","192.168.159.12","TCP","66","80  >  5368 [SYN, ACK] Seq=0 Ack=1 Win=5840 Len=0 MSS=1460 SACK_PERM WS=128"
"172","2020-01-01 18:53:55.022141","192.168.159.12","192.168.159.131","TCP","54","5368  >  80 [ACK] Seq=1 Ack=1 Win=1051136 Len=0"
"173","2020-01-01 18:53:55.075528","192.168.159.12","192.168.159.131","HTTP","188","GET / HTTP/1.1 "
"174","2020-01-01 18:53:55.075842","192.168.159.131","192.168.159.12","TCP","54","80  >  5368 [ACK] Seq=1 Ack=135 Win=6912 Len=0"
"175","2020-01-01 18:53:55.076767","192.168.159.131","192.168.159.12","HTTP","967","HTTP/1.1 200 OK  (text/html)"
"176","2020-01-01 18:53:55.117095","192.168.159.12","192.168.159.131","TCP","54","5368  >  80 [ACK] Seq=135 Ack=914 Win=1050112 Len=0"
"177","2020-01-01 18:53:56.801742","192.168.159.10","192.168.159.131","TCP","54","5362  >  80 [FIN, ACK] Seq=135 Ack=914 Win=1050112 Len=0"
"178","2020-01-01 18:53:56.802159","192.168.159.131","192.168.159.10","TCP","54","80  >  5362 [FIN, ACK] Seq=914 Ack=136 Win=6912 Len=0"
"179","2020-01-01 18:53:56.802299","192.168.159.10","192.168.159.131","TCP","54","5362  >  80 [ACK] Seq=136 Ack=915 Win=1050112 Len=0"
"180","2020-01-01 18:53:56.802385","192.168.159.10","192.168.159.131","TCP","66","5370  >  80 [SYN] Seq=0 Win=64240 Len=0 MSS=1460 WS=256 SACK_PERM"
"181","2020-01-01 18:53:56.802731","192.168.159.131","192.168.159.10","TCP","66","80  >  5370 [SYN, ACK] Seq=0 Ack=1 Win=5840 Len=0 MSS=1460 SACK_PERM WS=128"
"182","2020-01-01 18:53:56.802899","192.168.159.10","192.168.159.131","TCP","54","5370  >  80 [ACK] Seq=1 Ack=1 Win=131328 Len=0"
"183","2020-01-01 18:53:56.860486","192.168.159.10","192.168.159.131","HTTP","188","GET / HTTP/1.1 "
"184","2020-01-01 18:53:56.860847","192.168.159.131","192.168.159.10","TCP","54","80  >  5370 [ACK] Seq=1 Ack=135 Win=6912 Len=0"
"185","2020-01-01 18:53:56.861653","192.168.159.131","192.168.159.10","HTTP","967","HTTP/1.1 200 OK  (text/html)"
"186","2020-01-01 18:53:56.908203","192.168.159.10","192.168.159.131","TCP","54","5370  >  80 [ACK] Seq=135 Ack=914 Win=1051136 Len=0"
"187","2020-01-01 18:53:58.014986","192.168.159.11","192.168.159.131","TCP","54","5364  >  80 [FIN, ACK] Seq=135 Ack=914 Win=130304 Len=0"
"188","2020-01-01 18:53:58.015335","192.168.159.131","192.168.159.11","TCP","54","80  >  5364 [FIN, ACK] Seq=914 Ack=136 Win=6912 Len=0"
"189","2020-01-01 18:53:58.015465","192.168.159.11","192.168.159.131","TCP","54","5364  >  80 [ACK] Seq=136 Ack=915 Win=130304 Len=0"
"190","2020-01-01 18:53:58.015642","192.168.159.11","192.168.159.131","TCP","66","5372  >  80 [SYN] Seq=0 Win=64240 Len=0 MSS=1460 WS=256 SACK_PERM"
"191","2020-01-01 18:53:58.015976","192.168.159.131","192.168.159.11","TCP","66","80  >  5372 [SYN, ACK] Seq=0 Ack=1 Win=5840 Len=0 MSS=1460 SACK_PERM WS=128"
"192","2020-01-01 18:53:58.016137","192.168.159.11","192.168.159.131","TCP","54","5372  >  80 [ACK] Seq=1 Ack=1 Win=131328 Len=0"
"193","2020-01-01 18:53:58.073837","192.168.159.11","192.168.159.131","HTTP","188","GET / HTTP/1.1 "
"194","2020-01-01 18:53:58.074317","192.168.159.131","192.168.159.11","TCP","54","80  >  5372 [ACK] Seq=1 Ack=135 Win=6912 Len=0"
"195","2020-01-01 18:53:58.074749","192.168.159.131","192.168.159.11","HTTP","967","HTTP/1.1 200 OK  (text/html)"
"196","2020-01-01 18:53:58.115311","192.168.159.11","192.168.159.131","TCP","54","5372  >  80 [ACK] Seq=135 Ack=914 Win=1051136 Len=0"
"197","2020-01-01 18:53:59.012305","192.168.159.13","192.168.159.131","TCP","58","54943  >  80 [SYN] Seq=0 Win=1024 Len=0 MSS=1460"
"198","2020-01-01 18:53:59.012748","192.168.159.131","192.168.159.13","TCP","58","80  >  54943 [SYN, ACK] Seq=0 Ack=1 Win=5840 Len=0 MSS=1460"
"199","2020-01-01 18:53:59.012886","192.168.159.13","192.168.159.131","TCP","54","54943  >  80 [RST] Seq=1 Win=0 Len=0"
"200","2020-01-01 18:53:59.065795","192.168.159.13","192.168.159.131","TCP","66","5374  >  80 [SYN] Seq=0 Win=64240 Len=0 MSS=1460 WS=256 SACK_PERM"
"201","2020-01-01 18:53:59.066049","192.168.159.131","192.168.159.13","TCP","66","80  >  5374 [SYN, ACK] Seq=0 Ack=1 Win=5840 Len=0 MSS=1460 SACK_PERM WS=128"
"202","2020-01-01 18:53:59.066187","192.168.159.13","192.168.159.131","TCP","54","5374  >  80 [ACK] Seq=1 Ack=1 Win=1051136 Len=0"
"203","2020-01-01 18:53:59.118422","192.168.159.13","192.168.159.131","HTTP","72","GET / HTTP/1.0 "
"204","2020-01-01 18:53:59.118820","192.168.159.131","192.168.159.13","TCP","54","80  >  5374 [ACK] Seq=1 Ack=19 Win=5888 Len=0"
"205","2020-01-01 18:53:59.119242","192.168.159.131","192.168.159.13","HTTP","986","HTTP/1.1 200 OK  (text/html)"
"206","2020-01-01 18:53:59.119986","192.168.159.131","192.168.159.13","TCP","54","80  >  5374 [FIN, ACK] Seq=933 Ack=19 Win=5888 Len=0"
"207","2020-01-01 18:53:59.120060","192.168.159.13","192.168.159.131","TCP","54","5374  >  80 [ACK] Seq=19 Ack=934 Win=1050112 Len=0"
"208","2020-01-01 18:53:59.221324","192.168.159.13","192.168.159.131","TCP","54","5374  >  80 [FIN, ACK] Seq=19 Ack=934 Win=1050112 Len=0"
"209","2020-01-01 18:53:59.221468","192.168.159.131","192.168.159.13","TCP","54","80  >  5374 [ACK] Seq=934 Ack=20 Win=5888 Len=0"
"210","2020-01-01 18:53:59.221700","192.168.159.13","192.168.159.131","TCP","66","5375  >  80 [SYN] Seq=0 Win=64240 Len=0 MSS=1460 WS=256 SACK_PERM"
"211","2020-01-01 18:53:59.221836","192.168.159.131","192.168.159.13","TCP","66","80  >  5375 [SYN, ACK] Seq=0 Ack=1 Win=5840 Len=0 MSS=1460 SACK_PERM WS=128"
"212","2020-01-01 18:53:59.221932","192.168.159.13","192.168.159.131","TCP","54","5375  >  80 [ACK] Seq=1 Ack=1 Win=1051136 Len=0"
"213","2020-01-01 18:53:59.278136","192.168.159.13","192.168.159.131","HTTP","188","GET / HTTP/1.1 "
"214","2020-01-01 18:53:59.278538","192.168.159.131","192.168.159.13","TCP","54","80  >  5375 [ACK] Seq=1 Ack=135 Win=6912 Len=0"
"215","2020-01-01 18:53:59.279124","192.168.159.131","192.168.159.13","HTTP","967","HTTP/1.1 200 OK  (text/html)"
"216","2020-01-01 18:53:59.323244","192.168.159.13","192.168.159.131","TCP","54","5375  >  80 [ACK] Seq=135 Ack=914 Win=1050112 Len=0"
"217","2020-01-01 18:54:00.903852","192.168.159.14","192.168.159.131","TCP","54","5366  >  80 [FIN, ACK] Seq=135 Ack=914 Win=1050112 Len=0"
"218","2020-01-01 18:54:00.904124","192.168.159.131","192.168.159.14","TCP","54","80  >  5366 [FIN, ACK] Seq=914 Ack=136 Win=6912 Len=0"
"219","2020-01-01 18:54:00.904221","192.168.159.14","192.168.159.131","TCP","54","5366  >  80 [ACK] Seq=136 Ack=915 Win=1050112 Len=0"
"220","2020-01-01 18:54:00.904326","192.168.159.14","192.168.159.131","TCP","66","5377  >  80 [SYN] Seq=0 Win=64240 Len=0 MSS=1460 WS=256 SACK_PERM"
"221","2020-01-01 18:54:00.904462","192.168.159.131","192.168.159.14","TCP","66","80  >  5377 [SYN, ACK] Seq=0 Ack=1 Win=5840 Len=0 MSS=1460 SACK_PERM WS=128"
"222","2020-01-01 18:54:00.904583","192.168.159.14","192.168.159.131","TCP","54","5377  >  80 [ACK] Seq=1 Ack=1 Win=1051136 Len=0"
"223","2020-01-01 18:54:00.959707","192.168.159.14","192.168.159.131","HTTP","188","GET / HTTP/1.1 "
"224","2020-01-01 18:54:00.960121","192.168.159.131","192.168.159.14","TCP","54","80  >  5377 [ACK] Seq=1 Ack=135 Win=6912 Len=0"
"225","2020-01-01 18:54:00.960542","192.168.159.131","192.168.159.14","HTTP","967","HTTP/1.1 200 OK  (text/html)"
"226","2020-01-01 18:54:01.004369","192.168.159.14","192.168.159.131","TCP","54","5377  >  80 [ACK] Seq=135 Ack=914 Win=1050112 Len=0"
"227","2020-01-01 18:54:05.202354","192.168.159.12","192.168.159.131","TCP","54","5368  >  80 [FIN, ACK] Seq=135 Ack=914 Win=1050112 Len=0"
"228","2020-01-01 18:54:05.202668","192.168.159.131","192.168.159.12","TCP","54","80  >  5368 [FIN, ACK] Seq=914 Ack=136 Win=6912 Len=0"
"229","2020-01-01 18:54:05.202808","192.168.159.12","192.168.159.131","TCP","54","5368  >  80 [ACK] Seq=136 Ack=915 Win=1050112 Len=0"
"230","2020-01-01 18:54:05.202932","192.168.159.12","192.168.159.131","TCP","66","5379  >  80 [SYN] Seq=0 Win=64240 Len=0 MSS=1460 WS=256 SACK_PERM"
"231","2020-01-01 18:54:05.203128","192.168.159.131","192.168.159.12","TCP","66","80  >  5379 [SYN, ACK] Seq=0 Ack=1 Win=5840 Len=0 MSS=1460 SACK_PERM WS=128"
"232","2020-01-01 18:54:05.203294","192.168.159.12","192.168.159.131","TCP","54","5379  >  80 [ACK] Seq=1 Ack=1 Win=1051136 Len=0"
"233","2020-01-01 18:54:05.259921","192.168.159.12","192.168.159.131","HTTP","188","GET / HTTP/1.1 "
"234","2020-01-01 18:54:05.260374","192.168.159.131","192.168.159.12","TCP","54","80  >  5379 [ACK] Seq=1 Ack=135 Win=6912 Len=0"
"235","2020-01-01 18:54:05.260998","192.168.159.131","192.168.159.12","HTTP","967","HTTP/1.1 200 OK  (text/html)"
"236","2020-01-01 18:54:05.302347","192.168.159.12","192.168.159.131","TCP","54","5379  >  80 [ACK] Seq=135 Ack=914 Win=1050112 Len=0"
"237","2020-01-01 18:54:06.991303","192.168.159.10","192.168.159.131","TCP","54","5370  >  80 [FIN, ACK] Seq=135 Ack=914 Win=1051136 Len=0"
"238","2020-01-01 18:54:06.991533","192.168.159.131","192.168.159.10","TCP","54","80  >  5370 [FIN, ACK] Seq=914 Ack=136 Win=6912 Len=0"
"239","2020-01-01 18:54:06.991628","192.168.159.10","192.168.159.131","TCP","54","5370  >  80 [ACK] Seq=136 Ack=915 Win=1051136 Len=0"
"240","2020-01-01 18:54:06.991733","192.168.159.10","192.168.159.131","TCP","66","5381  >  80 [SYN] Seq=0 Win=64240 Len=0 MSS=1460 WS=256 SACK_PERM"
"241","2020-01-01 18:54:06.991868","192.168.159.131","192.168.159.10","TCP","66","80  >  5381 [SYN, ACK] Seq=0 Ack=1 Win=5840 Len=0 MSS=1460 SACK_PERM WS=128"
"242","2020-01-01 18:54:06.991988","192.168.159.10","192.168.159.131","TCP","54","5381  >  80 [ACK] Seq=1 Ack=1 Win=1051136 Len=0"
"243","2020-01-01 18:54:07.045615","192.168.159.10","192.168.159.131","HTTP","188","GET / HTTP/1.1 "
"244","2020-01-01 18:54:07.045938","192.168.159.131","192.168.159.10","TCP","54","80  >  5381 [ACK] Seq=1 Ack=135 Win=6912 Len=0"
"245","2020-01-01 18:54:07.046250","192.168.159.131","192.168.159.10","HTTP","967","HTTP/1.1 200 OK  (text/html)"
"246","2020-01-01 18:54:07.089014","192.168.159.10","192.168.159.131","TCP","54","5381  >  80 [ACK] Seq=135 Ack=914 Win=1050112 Len=0"
"247","2020-01-01 18:54:08.193429","192.168.159.11","192.168.159.131","TCP","54","5372  >  80 [FIN, ACK] Seq=135 Ack=914 Win=1051136 Len=0"
"248","2020-01-01 18:54:08.193781","192.168.159.131","192.168.159.11","TCP","54","80  >  5372 [FIN, ACK] Seq=914 Ack=136 Win=6912 Len=0"
"249","2020-01-01 18:54:08.193938","192.168.159.11","192.168.159.131","TCP","54","5372  >  80 [ACK] Seq=136 Ack=915 Win=1051136 Len=0"
"250","2020-01-01 18:54:08.194174","192.168.159.11","192.168.159.131","TCP","66","5383  >  80 [SYN] Seq=0 Win=64240 Len=0 MSS=1460 WS=256 SACK_PERM"
"251","2020-01-01 18:54:08.194742","192.168.159.131","192.168.159.11","TCP","66","80  >  5383 [SYN, ACK] Seq=0 Ack=1 Win=5840 Len=0 MSS=1460 SACK_PERM WS=128"
"252","2020-01-01 18:54:08.194900","192.168.159.11","192.168.159.131","TCP","54","5383  >  80 [ACK] Seq=1 Ack=1 Win=1051136 Len=0"
"253","2020-01-01 18:54:08.253419","192.168.159.11","192.168.159.131","HTTP","188","GET / HTTP/1.1 "
"254","2020-01-01 18:54:08.253835","192.168.159.131","192.168.159.11","TCP","54","80  >  5383 [ACK] Seq=1 Ack=135 Win=6912 Len=0"
"255","2020-01-01 18:54:08.254251","192.168.159.131","192.168.159.11","HTTP","967","HTTP/1.1 200 OK  (text/html)"
"256","2020-01-01 18:54:08.295858","192.168.159.11","192.168.159.131","TCP","54","5383  >  80 [ACK] Seq=135 Ack=914 Win=1050112 Len=0"
"257","2020-01-01 18:54:09.400179","192.168.159.13","192.168.159.131","TCP","54","5375  >  80 [FIN, ACK] Seq=135 Ack=914 Win=1050112 Len=0"
"258","2020-01-01 18:54:09.400606","192.168.159.131","192.168.159.13","TCP","54","80  >  5375 [FIN, ACK] Seq=914 Ack=136 Win=6912 Len=0"
"259","2020-01-01 18:54:09.400767","192.168.159.13","192.168.159.131","TCP","54","5375  >  80 [ACK] Seq=136 Ack=915 Win=1050112 Len=0"
"260","2020-01-01 18:54:09.400851","192.168.159.13","192.168.159.131","TCP","66","5385  >  80 [SYN] Seq=0 Win=64240 Len=0 MSS=1460 WS=256 SACK_PERM"
"261","2020-01-01 18:54:09.401255","192.168.159.131","192.168.159.13","TCP","66","80  >  5385 [SYN, ACK] Seq=0 Ack=1 Win=5840 Len=0 MSS=1460 SACK_PERM WS=128"
"262","2020-01-01 18:54:09.401418","192.168.159.13","192.168.159.131","TCP","54","5385  >  80 [ACK] Seq=1 Ack=1 Win=131328 Len=0"
"263","2020-01-01 18:54:09.459474","192.168.159.13","192.168.159.131","HTTP","188","GET / HTTP/1.1 "
"264","2020-01-01 18:54:09.460183","192.168.159.131","192.168.159.13","TCP","54","80  >  5385 [ACK] Seq=1 Ack=135 Win=6912 Len=0"
"265","2020-01-01 18:54:09.461557","192.168.159.131","192.168.159.13","HTTP","967","HTTP/1.1 200 OK  (text/html)"
"266","2020-01-01 18:54:09.505620","192.168.159.13","192.168.159.131","TCP","54","5385  >  80 [ACK] Seq=135 Ack=914 Win=130304 Len=0"
"267","2020-01-01 18:54:11.088297","192.168.159.14","192.168.159.131","TCP","54","5377  >  80 [FIN, ACK] Seq=135 Ack=914 Win=1050112 Len=0"
"268","2020-01-01 18:54:11.088657","192.168.159.131","192.168.159.14","TCP","54","80  >  5377 [FIN, ACK] Seq=914 Ack=136 Win=6912 Len=0"
"269","2020-01-01 18:54:11.088809","192.168.159.14","192.168.159.131","TCP","54","5377  >  80 [ACK] Seq=136 Ack=915 Win=1050112 Len=0"
"270","2020-01-01 18:54:11.089003","192.168.159.14","192.168.159.131","TCP","66","5387  >  80 [SYN] Seq=0 Win=64240 Len=0 MSS=1460 WS=256 SACK_PERM"
"271","2020-01-01 18:54:11.089481","192.168.159.131","192.168.159.14","TCP","66","80  >  5387 [SYN, ACK] Seq=0 Ack=1 Win=5840 Len=0 MSS=1460 SACK_PERM WS=128"
"272","2020-01-01 18:54:11.089662","192.168.159.14","192.168.159.131","TCP","54","5387  >  80 [ACK] Seq=1 Ack=1 Win=1051136 Len=0"
"273","2020-01-01 18:54:11.145386","192.168.159.14","192.168.159.131","HTTP","188","GET / HTTP/1.1 "
"274","2020-01-01 18:54:11.145689","192.168.159.131","192.168.159.14","TCP","54","80  >  5387 [ACK] Seq=1 Ack=135 Win=6912 Len=0"
"275","2020-01-01 18:54:11.146143","192.168.159.131","192.168.159.14","HTTP","967","HTTP/1.1 200 OK  (text/html)"
"276","2020-01-01 18:54:11.191218","192.168.159.14","192.168.159.131","TCP","54","5387  >  80 [ACK] Seq=135 Ack=914 Win=1050112 Len=0"
"277","2020-01-01 18:54:11.488392","192.168.159.1","192.168.159.255","BROWSER","253","Domain/Workgroup Announcement NATHEALTH, NT Workstation, Domain Enum"
"278","2020-01-01 18:54:15.412151","192.168.159.12","192.168.159.131","TCP","54","5379  >  80 [FIN, ACK] Seq=135 Ack=914 Win=1050112 Len=0"
"279","2020-01-01 18:54:15.412359","192.168.159.131","192.168.159.12","TCP","54","80  >  5379 [FIN, ACK] Seq=914 Ack=136 Win=6912 Len=0"
"280","2020-01-01 18:54:15.412423","192.168.159.12","192.168.159.131","TCP","54","5379  >  80 [ACK] Seq=136 Ack=915 Win=1050112 Len=0"
"281","2020-01-01 18:54:15.412434","192.168.159.12","192.168.159.131","TCP","66","5389  >  80 [SYN] Seq=0 Win=64240 Len=0 MSS=1460 WS=256 SACK_PERM"
"282","2020-01-01 18:54:15.412526","192.168.159.131","192.168.159.12","TCP","66","80  >  5389 [SYN, ACK] Seq=0 Ack=1 Win=5840 Len=0 MSS=1460 SACK_PERM WS=128"
"283","2020-01-01 18:54:15.412616","192.168.159.12","192.168.159.131","TCP","54","5389  >  80 [ACK] Seq=1 Ack=1 Win=1051136 Len=0"
"284","2020-01-01 18:54:15.469702","192.168.159.12","192.168.159.131","HTTP","188","GET / HTTP/1.1 "
"285","2020-01-01 18:54:15.470137","192.168.159.131","192.168.159.12","TCP","54","80  >  5389 [ACK] Seq=1 Ack=135 Win=6912 Len=0"
"286","2020-01-01 18:54:15.470756","192.168.159.131","192.168.159.12","HTTP","967","HTTP/1.1 200 OK  (text/html)"
"287","2020-01-01 18:54:15.515508","192.168.159.12","192.168.159.131","TCP","54","5389  >  80 [ACK] Seq=135 Ack=914 Win=1050112 Len=0"
"288","2020-01-01 18:54:17.146789","192.168.159.10","192.168.159.131","TCP","54","5381  >  80 [FIN, ACK] Seq=135 Ack=914 Win=1050112 Len=0"
"289","2020-01-01 18:54:17.146995","192.168.159.131","192.168.159.10","TCP","54","80  >  5381 [FIN, ACK] Seq=914 Ack=136 Win=6912 Len=0"
"290","2020-01-01 18:54:17.147087","192.168.159.10","192.168.159.131","TCP","54","5381  >  80 [ACK] Seq=136 Ack=915 Win=1050112 Len=0"
"291","2020-01-01 18:54:17.147227","192.168.159.10","192.168.159.131","TCP","66","5391  >  80 [SYN] Seq=0 Win=64240 Len=0 MSS=1460 WS=256 SACK_PERM"
"292","2020-01-01 18:54:17.147388","192.168.159.131","192.168.159.10","TCP","66","80  >  5391 [SYN, ACK] Seq=0 Ack=1 Win=5840 Len=0 MSS=1460 SACK_PERM WS=128"
"293","2020-01-01 18:54:17.147525","192.168.159.10","192.168.159.131","TCP","54","5391  >  80 [ACK] Seq=1 Ack=1 Win=1051136 Len=0"
"294","2020-01-01 18:54:17.204686","192.168.159.10","192.168.159.131","HTTP","188","GET / HTTP/1.1 "
"295","2020-01-01 18:54:17.205087","192.168.159.131","192.168.159.10","TCP","54","80  >  5391 [ACK] Seq=1 Ack=135 Win=6912 Len=0"
"296","2020-01-01 18:54:17.205642","192.168.159.131","192.168.159.10","HTTP","967","HTTP/1.1 200 OK  (text/html)"
"297","2020-01-01 18:54:17.247431","192.168.159.10","192.168.159.131","TCP","54","5391  >  80 [ACK] Seq=135 Ack=914 Win=1050112 Len=0"
"298","2020-01-01 18:54:18.354963","192.168.159.11","192.168.159.131","TCP","54","5383  >  80 [FIN, ACK] Seq=135 Ack=914 Win=1050112 Len=0"
"299","2020-01-01 18:54:18.355271","192.168.159.131","192.168.159.11","TCP","54","80  >  5383 [FIN, ACK] Seq=914 Ack=136 Win=6912 Len=0"
"300","2020-01-01 18:54:18.355393","192.168.159.11","192.168.159.131","TCP","54","5383  >  80 [ACK] Seq=136 Ack=915 Win=1050112 Len=0"
"301","2020-01-01 18:54:18.355571","192.168.159.11","192.168.159.131","TCP","66","5393  >  80 [SYN] Seq=0 Win=64240 Len=0 MSS=1460 WS=256 SACK_PERM"
